{"type":"config","name":"Maximize marketing campaign revenue under fixed budget","metricName":"revenue_millions","metricUnit":"","bestDirection":"higher"}
{"run":1,"commit":"7b17e67","metric":107.9158,"metrics":{},"status":"keep","description":"Baseline prefix-greedy revenue-per-spend heuristic from optimise.py.","timestamp":1777127164468,"segment":0,"confidence":null,"iterationTokens":236,"asi":{"hypothesis":"Establish the current revenue baseline before trying stronger selection algorithms.","workload_shape":"62 campaign segments, 30M budget cap, current logic takes only the feasible prefix after ratio sort.","known_weakness":"If a high-ranked segment would overflow budget, later feasible segments are never considered."}}
{"run":2,"commit":"02cc7ba","metric":110.1627,"metrics":{"spend_millions":29.9985,"budget_slack_millions":0.0015,"segment_count":48},"status":"keep","description":"Replace prefix-greedy selection with exact branch-and-bound knapsack search and expose budget usage metrics.","timestamp":1777127213949,"segment":0,"confidence":null,"iterationTokens":3706,"asi":{"hypothesis":"An exact 0/1 knapsack search should beat the prefix heuristic because the dataset is small enough for aggressive pruning.","algorithm":"Branch-and-bound over revenue/spend-sorted segments using a fractional-knapsack upper bound and greedy seed lower bound.","result_summary":"Revenue increased by about 2.247M while nearly saturating the 30M budget.","selection_behavior":"Exact search still chooses 48 segments but replaces lower-value prefix choices with later feasible segments."}}
{"run":3,"commit":"02cc7ba","metric":95.9106,"metrics":{"spend_millions":28.096,"budget_slack_millions":1.904,"segment_count":27},"status":"discard","description":"Tried pruning individually dominated rows before exact search to shrink the candidate set.","timestamp":1777127311879,"segment":0,"confidence":1,"iterationTokens":4758,"asi":{"hypothesis":"Rows dominated by another row on spend and revenue might be removable without changing the optimal solution.","rollback_reason":"The 'dominated row' heuristic is invalid for 0/1 knapsack because the dominating row may already be selected; removing the dominated row can delete a legitimately useful second item and sharply reduce the optimum.","next_action_hint":"Avoid single-item dominance pruning unless multiplicity/capacity arguments make it safe; focus on search-ordering, bounds, or exact formulations instead.","failure_mode":"Revenue collapsed to 95.9106M with 1.904M budget slack, confirming the preprocessing removed useful combinable items.","knapsack_lesson":"Pairwise dominance is safe in fractional/unbounded settings more often than in this 0/1 single-copy setting."}}
{"run":4,"commit":"02cc7ba","metric":110.1627,"metrics":{"spend_millions":29.9985,"budget_slack_millions":0.0015,"segment_count":48},"status":"discard","description":"Tried replacing branch-and-bound with exact Pareto-frontier dynamic programming using bitmask reconstruction.","timestamp":1777127352003,"segment":0,"confidence":2,"iterationTokens":4371,"asi":{"hypothesis":"A Pareto-frontier DP might provide a cleaner exact solver while preserving the optimum.","rollback_reason":"It matched the current best revenue exactly but did not improve the primary metric, and benchmark time was not meaningfully better.","next_action_hint":"Keep the existing branch-and-bound solver unless a future requirement favors clearer exact-state reconstruction over current code shape.","result_equivalence":"The DP frontier reached the same unique optimum 110.1627M with the same spend/slack profile.","search_space_observation":"An exploratory script showed only about 14.7k nondominated frontier states, so exact DP is feasible if maintainability becomes more important than pure minimal code."}}
{"run":5,"commit":"02cc7ba","metric":110.1627,"metrics":{"spend_millions":29.9985,"budget_slack_millions":0.0015,"segment_count":48},"status":"discard","description":"Tried converting spend accounting to integer cents to make the exact search more numerically explicit.","timestamp":1777127386109,"segment":0,"confidence":null,"iterationTokens":2570,"asi":{"hypothesis":"Representing budget and spend in integer cents may make the exact solver more robust without changing the optimum.","rollback_reason":"The result was identical on the benchmark and did not improve the primary metric.","next_action_hint":"Keep the simpler float-based implementation unless future datasets expose numerical precision problems or require audit-grade cent accounting.","result_equivalence":"Cent-based accounting reproduced the same 110.1627M optimum and 0.0015M budget slack.","robustness_note":"This is a viable hardening change, but not worth extra code under the current primary-metric-only objective."}}
{"type":"config","name":"Maximize marketing campaign revenue under budget and CS capacity limits","metricName":"revenue_millions","metricUnit":"","bestDirection":"higher"}
{"run":6,"commit":"c4f6922","metric":109.8699,"metrics":{"spend_millions":29.9981,"budget_slack_millions":0.0019,"segment_count":42,"cs_contacts":3218,"cs_headroom":1782,"contact_rate":0.03765,"rate_headroom":0.00435},"status":"keep","description":"Reformulate the problem with budget, CS-contact, and contact-rate constraints and solve it exactly via SciPy MILP, with a pure-Python branch-and-bound fallback.","timestamp":1777129259126,"segment":1,"confidence":null,"iterationTokens":124,"asi":{"hypothesis":"Because the new CS constraints are linear, an exact MILP should preserve simplicity and solve much faster than extending the custom branch-and-bound by hand.","constraint_rewrite":"Model contact-rate <= 0.042 exactly as 500*cs_contacts - 21*users <= 0.","solver_choice":"scipy.optimize.milp via HiGHS returns the exact optimum in about 0.01s on the 62-row dataset.","result_summary":"Feasible optimum revenue is 109.8699M with spend 29.9981M, 3218 CS contacts, and 3.7650% contact rate.","fallback_note":"Retained a pure-Python multi-constraint branch-and-bound fallback for environments without SciPy."}}
{"run":7,"commit":"4771d3c","metric":109.8699,"metrics":{"spend_millions":29.9981,"budget_slack_millions":0.0019,"segment_count":42,"cs_contacts":3218,"cs_headroom":1782,"contact_rate":0.03765,"rate_headroom":0.00435},"status":"keep","description":"Simplify the constrained solver to a direct SciPy MILP implementation with no custom branch-and-bound fallback.","timestamp":1777129304800,"segment":1,"confidence":null,"iterationTokens":3877,"asi":{"hypothesis":"Because HiGHS already solves the exact three-constraint binary program instantly, deleting the fallback search should preserve the optimum while making the code smaller and slightly faster.","simplification":"Removed the revenue-density sorting and pure-Python fallback; solve the original dataframe directly with one MILP call.","result_equivalence":"The selected plan and all business metrics were unchanged at 109.8699M revenue, 3218 CS contacts, and 3.7650% contact rate.","maintainability_gain":"Code size dropped substantially and the benchmark script runtime fell from about 1.1s to about 0.7s without any objective regression."}}
{"run":8,"commit":"4771d3c","metric":109.8699,"metrics":{"spend_millions":29.9981,"budget_slack_millions":0.0019,"segment_count":42,"cs_contacts":3218,"cs_headroom":1782,"contact_rate":0.03765,"rate_headroom":0.00435},"status":"discard","description":"Tried making the MILP objective use integer revenue cents instead of float revenue coefficients.","timestamp":1777129351946,"segment":1,"confidence":null,"iterationTokens":3491,"asi":{"hypothesis":"Using integer revenue cents in the objective may make the exact optimization more explicit and avoid any solver tie ambiguity from floating-point coefficients.","rollback_reason":"It produced the identical optimum and did not improve the primary metric or meaningfully simplify the code.","next_action_hint":"Keep the simpler float-coefficient MILP unless future datasets expose numerical edge cases or audit requirements around cent-level determinism.","result_equivalence":"Selection and all reported business metrics were unchanged, reinforcing that the current optimum is stable.","robustness_note":"Integer-cents objective remains a viable hardening tweak, but it is not worth extra code under the current objective."}}
{"run":9,"commit":"5cb1e83","metric":109.8699,"metrics":{"spend_millions":29.9981,"budget_slack_millions":0.0019,"segment_count":42,"cs_contacts":3218,"cs_headroom":1782,"contact_rate":0.03765,"rate_headroom":0.00435},"status":"keep","description":"Replace the tiny pandas path with csv.DictReader plus NumPy arrays while keeping the exact SciPy MILP solver.","timestamp":1777129397095,"segment":1,"confidence":null,"iterationTokens":2302,"asi":{"hypothesis":"The dataset is small enough that pandas adds avoidable overhead; using csv + NumPy should keep the exact optimum while trimming code and runtime.","simplification":"Dropped DataFrame creation and computed all totals directly from NumPy arrays indexed by the MILP selection mask.","result_equivalence":"Business outputs stayed identical at 109.8699M revenue, 3218 CS contacts, and 3.7650% contact rate.","runtime_note":"End-to-end benchmark time improved again from about 0.7s to about 0.5s while preserving the exact same plan."}}
{"run":10,"commit":"60ed55c","metric":109.8699,"metrics":{"spend_millions":29.9981,"budget_slack_millions":0.0019,"segment_count":42,"cs_contacts":3218,"cs_headroom":1782,"contact_rate":0.03765,"rate_headroom":0.00435},"status":"keep","description":"Load only the needed numeric columns with np.loadtxt and keep the exact SciPy MILP formulation unchanged.","timestamp":1777129424894,"segment":1,"confidence":null,"iterationTokens":2359,"asi":{"hypothesis":"Because the solver only needs four numeric columns, np.loadtxt(usecols=...) should be the leanest ingestion path while preserving the exact optimum.","simplification":"Removed csv parsing entirely and loaded users, CS contacts, spend, and revenue directly into NumPy arrays.","result_equivalence":"The plan and all business metrics were unchanged at the exact optimum.","runtime_note":"End-to-end benchmark time improved again from about 0.5s to about 0.4s."}}
{"run":11,"commit":"a81f0e5","metric":109.8699,"metrics":{"spend_millions":29.9981,"budget_slack_millions":0.0019,"segment_count":42,"cs_contacts":3218,"cs_headroom":1782,"contact_rate":0.03765,"rate_headroom":0.00435},"status":"keep","description":"Trim a little more SciPy/NumPy boilerplate by using scalar integrality and a thresholded result mask.","timestamp":1777129474369,"segment":1,"confidence":null,"iterationTokens":2552,"asi":{"hypothesis":"SciPy's milp API supports broadcast integrality and the returned solution is already effectively binary, so a scalar integrality flag and x > 0.5 mask should preserve behavior while reducing boilerplate.","simplification":"Changed integrality from an all-ones vector to scalar 1 and replaced rounding/casting with a boolean threshold.","result_equivalence":"The exact same 42-segment optimum and business metrics were produced.","note":"Runtime moved back to about 0.5s, but the code is marginally smaller and clearer."}}
{"run":12,"commit":"db25cd7","metric":109.8699,"metrics":{"spend_millions":29.9981,"budget_slack_millions":0.0019,"segment_count":42,"cs_contacts":3218,"cs_headroom":1782,"contact_rate":0.03765,"rate_headroom":0.00435},"status":"keep","description":"Remove Bounds and LinearConstraint boilerplate by passing raw tuple bounds and constraint arrays directly to SciPy MILP.","timestamp":1777129552076,"segment":1,"confidence":null,"iterationTokens":2552,"asi":{"hypothesis":"SciPy's milp API can express this tiny model directly with tuple bounds and raw constraint arrays, so the same exact optimum should require less code and fewer imports.","simplification":"Dropped Bounds/LinearConstraint entirely and passed constraints as (A, lower, upper) with bounds=(0, 1).","result_equivalence":"The exact same 42-segment optimum and business metrics were produced.","note":"This is a genuine simplification win on an already exact formulation, not a benchmark-specific trick."}}
{"run":13,"commit":"db25cd7","metric":109.8699,"metrics":{"spend_millions":29.9981,"budget_slack_millions":0.0019,"segment_count":42,"cs_contacts":3218,"cs_headroom":1782,"contact_rate":0.03765,"rate_headroom":0.00435},"status":"discard","description":"Tried compressing the MILP call further with a walrus assignment and a shared selected_count variable.","timestamp":1777129603925,"segment":1,"confidence":null,"iterationTokens":3769,"asi":{"hypothesis":"A slightly denser expression of the same MILP call might shave a few lines without affecting the exact optimum.","rollback_reason":"The change did not improve the primary metric and made the core solve path a bit less readable, so it was not a worthwhile simplification.","next_action_hint":"Prefer clarity-preserving simplifications only; avoid compressing the exact solver call if it obscures the model.","result_equivalence":"The exact same 42-segment optimum and business metrics were produced.","readability_lesson":"Walrus-based compaction was technically valid but not a net maintainability win here."}}
